{
  "ward_id": "04",
  "source": "cache",
  "since": "2022-01",
  "series": [
    {"month": "2022-01", "permits": 1, "units": 3},
    {"month": "2022-02", "permits": 0, "units": 0},
    {"month": "2022-03", "permits": 0, "units": 0},
    {"month": "2022-04", "permits": 1, "units": 3},
    {"month": "2022-05", "permits": 0, "units": 0},
    {"month": "2022-06", "permits": 1, "units": 3},
    {"month": "2022-07", "permits": 0, "units": 0},
    {"month": "2022-08", "permits": 1, "units": 3},
    {"month": "2022-09", "permits": 0, "units": 0},
    {"month": "2022-10", "permits": 1, "units": 3},
    {"month": "2022-11", "permits": 1, "units": 3},
    {"month": "2022-12", "permits": 0, "units": 0},
    {"month": "2023-01", "permits": 0, "units": 0},
    {"month": "2023-02", "permits": 1, "units": 3},
    {"month": "2023-03", "permits": 0, "units": 0},
    {"month": "2023-04", "permits": 1, "units": 3},
    {"month": "2023-05", "permits": 0, "units": 0},
    {"month": "2023-06", "permits": 1, "units": 4},
    {"month": "2023-07", "permits": 1, "units": 3},
    {"month": "2023-08", "permits": 0, "units": 0},
    {"month": "2023-09", "permits": 2, "units": 7},
    {"month": "2023-10", "permits": 1, "units": 4},
    {"month": "2023-11", "permits": 1, "units": 3},
    {"month": "2023-12", "permits": 1, "units": 4},
    {"month": "2024-01", "permits": 1, "units": 3},
    {"month": "2024-02", "permits": 0, "units": 0},
    {"month": "2024-03", "permits": 2, "units": 7},
    {"month": "2024-04", "permits": 1, "units": 4},
    {"month": "2024-05", "permits": 1, "units": 3},
    {"month": "2024-06", "permits": 2, "units": 7},
    {"month": "2024-07", "permits": 1, "units": 4},
    {"month": "2024-08", "permits": 1, "units": 3},
    {"month": "2024-09", "permits": 2, "units": 6},
    {"month": "2024-10", "permits": 1, "units": 3},
    {"month": "2024-11", "permits": 1, "units": 3},
    {"month": "2024-12", "permits": 1, "units": 3},
    {"month": "2025-01", "permits": 1, "units": 3},
    {"month": "2025-02", "permits": 0, "units": 0},
    {"month": "2025-03", "permits": 1, "units": 3},
    {"month": "2025-04", "permits": 1, "units": 3},
    {"month": "2025-05", "permits": 2, "units": 6},
    {"month": "2025-06", "permits": 1, "units": 3},
    {"month": "2025-07", "permits": 1, "units": 3},
    {"month": "2025-08", "permits": 0, "units": 0},
    {"month": "2025-09", "permits": 2, "units": 6},
    {"month": "2025-10", "permits": 1, "units": 3},
    {"month": "2025-11", "permits": 1, "units": 3},
    {"month": "2025-12", "permits": 1, "units": 4},
    {"month": "2026-01", "permits": 0, "units": 0},
    {"month": "2026-02", "permits": 1, "units": 4},
    {"month": "2026-03", "permits": 1, "units": 4},
    {"month": "2026-04", "permits": 0, "units": 0},
    {"month": "2026-05", "permits": 1, "units": 4},
    {"month": "2026-06", "permits": 1, "units": 4},
    {"month": "2026-07", "permits": 1, "units": 4},
    {"month": "2026-08", "permits": 0, "units": 0},
    {"month": "2026-09", "permits": 2, "units": 7},
    {"month": "2026-10", "permits": 1, "units": 4}
  ],
  "markers": [
    {"month": "2023-05", "label": "Multiplexes allowed citywide"},
    {"month": "2026-10", "label": "Free designs released"}
  ],
  "generated_at": "2026-10-17T00:00:00Z"
}
